{"artifacts":{"docs/rulings/provenance_log.md":"c6cf3b99e9d36b214d2368d55b7c04c857b0033191ccf0e73f91133cb2c26fa0","handoffs/REBECCA_WORKFLOW_EFFICIENCY_P1_P10_IMPLEMENTATION_AND_COORDINATOR_ROLE_INIT_AUTHORIZATION_2026-08-21.md":"ef8ca3152a07a83227397cbc2dc93375d84e32bf1ed5da8ae1b580ecf6d6ac8d","specs/data/common_handoff_manifest_schema_v1.json":"ad0b4358d60dcea1752fc137dc38d977bf3e1eca9e5fc9d40926b91433b6002b","specs/data/common_handoff_manifest_schema_v1.json.sha256":"0b99efa97854ebaf1253e6b3b6231c229f4d98029ca9d7ec42da056dcd8e22c2","specs/data/workflow_state_metadata_schema_v1.json":"1139071192a07297b0e3f53ef04c0479f172207f297cc20ecf02a881249cef16","specs/data/workflow_state_metadata_schema_v1.json.sha256":"a20f7365d7325d0fa6b161fb6ebf42dfa8ef1311662d51031ed72407ca19904b","specs/workflow_efficiency_change_program_v1.md":"fdff21a2e12d4f78f22072cd8fd7a239c98303ab59c93f3ebb117722f911128f","specs/workflow_role_contract_amendments_v1.md":"2b41ed8830a4a1a7537f275d3fc16f6a871ac819cd75cc9db293446cedde61a4","state/STATE.md":"6bd3a15929032bbdb7e332cd7739b31641c05e5967037230f72445aadbd42ac6","state/STATE.metadata.json":"2ce2ef58807acbe2267dc4ae49e0b25af0ffa27e928dca993a617be701607ccd","state/STATE.metadata.json.sha256":"207e3af9be308d238500d52cb07fe51acd1d77d0a4231228c23ead9e40fecd6a","state/role_initialization/RECORDER_INITIALIZATION.md":"758e38ba6b60d9551bab7e41c5113ec441089a46383d718c0e741541fcaee8ca","tools/workflow_contract_validator.py":"7d9a814475bdc45c950f012f2708a6022f02daf333e2ef0fb51274c23351e893"},"authority_basis":[{"path":"handoffs/REBECCA_WORKFLOW_EFFICIENCY_P1_P10_IMPLEMENTATION_AND_COORDINATOR_ROLE_INIT_AUTHORIZATION_2026-08-21.md","sha":"8923112fde4ce95a6dad03f6c71f5235eeccc7e5"}],"base_sha":"7cfc86f97e8890185bc09e0c11eb34ac994fe0e0","checks_performed":["verified exact INTEGRATOR result and remote equality","verified STATE and metadata canonical hashes","verified normalized raw artifact inventory from exact Git blobs","validated manifest schema and sender extension","classified duplicated personal-contact regex match as immutable STATE-digest false positive; gitleaks clean"],"date":"2026-08-21","findings":[],"gate":"Serial RECORDER STATE-metadata attestation and provenance-metadata bootstrap","next_event":"RECORDER performs exactly two commits. Commit 1 appends Entry 116 only to docs/rulings/provenance_log.md, using the existing entry format: heading 'Entry 116 — Workflow Efficiency P1–P10 owner-metadata bootstrap custody attestation'; Date 2026-08-21; Regime B; Actors INTEGRATOR and RECORDER; gate served is owner-metadata bootstrap; INTEGRATOR source is 7cfc86f97e8890185bc09e0c11eb34ac994fe0e0; STATE.md canonical Git-blob SHA-256 is 6bd3a15929032bbdb7e332cd7739b31641c05e5967037230f72445aadbd42ac6; STATE metadata raw SHA-256 is 2ce2ef58807acbe2267dc4ae49e0b25af0ffa27e928dca993a617be701607ccd; attest both independently verified, schema-valid, current, owner INTEGRATOR, with no STATE edit; preserve all science/scoring/seed/model/merge holds; next event is provenance metadata publication and Coordinator merge custody. Commit 2 creates only docs/rulings/provenance_log.metadata.json and adjacent sidecar. Metadata is RFC-8785 canonical UTF-8 without BOM and no LF; source_commit is the exact full Commit-1 SHA; document_path docs/rulings/provenance_log.md; document_sha256 is the raw committed LF SHA-256 at Commit 1; as_of_utc 2026-08-21T23:05:00Z; supersedes_metadata_sha256 []; status current; document_role custody_history; owner_role RECORDER. Sidecar is lowercase metadata SHA-256, two spaces, basename, one LF. Validate, scan, push both commits, verify remote equality, and return to WORKFLOW COORDINATOR.","prohibited_actions":["editing STATE, STATE metadata, ledger, checkpoint, specifications, or role initializations","scientific, scoring, seed, model/tokenizer, or OCI activity","merge, gate decision, unrelated provenance entries, or inferred metadata fields"],"receiver_role":"RECORDER","regime":"B","remote_ref":"refs/heads/integrator/workflow-state-metadata-bootstrap","review_result_sha":"7cfc86f97e8890185bc09e0c11eb34ac994fe0e0","role_extension":{"ball_recorded":true,"role":"WORKFLOW_COORDINATOR"},"routing_ref_sha":"7cfc86f97e8890185bc09e0c11eb34ac994fe0e0","scan_attestation":{"base_sha":"e04589b819946d28fd0ed0ef99a3f40181ba66a2","findings":[],"manual_review":true,"tip_sha":"7cfc86f97e8890185bc09e0c11eb34ac994fe0e0","tool_status":"clean"},"schema_version":"common-handoff-manifest-v1","sender_role":"WORKFLOW_COORDINATOR","status":"READY","transfer_kind":"FORMAL_HANDOFF","work_branch":"recorder/workflow-provenance-metadata-bootstrap","work_item":"workflow_provenance_metadata_bootstrap"}
