{"artifacts":{".gitattributes":"03a4a697fd0aefe179874343764ac8fba05ea1f7df2076a1b0ff9b31acb6d994","handoffs/REBECCA_M4_POST_TOKENIZER_INTEGRATION_IMPLEMENTATION_RELEASE_2026-08-22.md":"49e5d9beb7933f5a30045e9236426c3732af0430de990ce0624555252158e752","handoffs/TASK_BUILDER_M4_POST_TOKENIZER_IR1_IR7_QUALITY_TRACE_2026-08-22.md":"8db20f80f4dc51a575c8c3f1f3af0c57f6c399324948e76fe437d835b0ee319d","handoffs/TASK_BUILDER_TO_WORKFLOW_COORDINATOR_M4_POST_TOKENIZER_IR1_IR7_REMEDIATION_2026-08-22.md":"ca265d9c2ee107d09c52fb138ae9232a2ffa18ecc36c7354dc776c46f8364495","specs/data/m4_post_tokenizer_combined_integration_inventory_v1.json":"848ba82d2e35cadb4e042356aaf79948e488aaca2803db50f11cc37a9544b1dd","specs/data/m4_post_tokenizer_combined_integration_inventory_v1.json.sha256":"b3e6c208e943eda6b457b04f175d7a842263c60e451e5b008281468ed1080422","specs/data/m4_post_tokenizer_integration_oci_launch_contract_v1.json":"11ae4799b6be6f0f14a5768a53fbf66b39b32d77e114a1ea581053fd8a3b6934","specs/data/m4_post_tokenizer_integration_oci_launch_contract_v1.json.sha256":"00e9cde1a6c4dc37c666d283ebc9db8b6674fea5541d10f5c16e78800235a975","specs/data/m4_tokenizer_executable_package_v1.json":"ee5f7bc601d94153d5819453d2f22a8fc6110103c88bd8242ac3ebe5c78ea2bc","specs/data/m4_tokenizer_executable_package_v1.json.sha256":"8237c04033cb77f90ce62fecd2f7adf8866426cdfd95360623f8088b3989903c","src/m4_post_tokenizer_integration.py":"1b2c7664ee8a0a190a63b3e421a4ec65af4d1d9fd3f68484924d49acac899f93","src/test_m4_post_tokenizer_integration.py":"d1517079e6f5ab40861605488146146c07019c6371bfd96582c614973dd76d1d","tests/run_m4_post_tokenizer_integration_tests.py":"96728a5da235e22156e1c669324c7b9c9a44376e7e77c6e07a8a80ddd53a7963","tests/run_m4_tokenizer_materialization_tests.py":"6710271634586cde643d06bba26f7ebcbdda6e51770ce1b2177e4abe45ff267c"},"authority_basis":[{"path":"handoffs/REBECCA_M4_POST_TOKENIZER_INTEGRATION_IMPLEMENTATION_RELEASE_2026-08-22.md","sha":"071392aadfcdf6c76b47f3f959578661658f7791"}],"base_sha":"94ea2c05fcdb74b314f23c229b673bc90ec485f0","checks_performed":["fresh core.autocrlf=true identity-first wrapper 40/40 PASS","exact pinned network-none read-only OCI integration suite 40/40 PASS","exact pinned network-none read-only OCI banked tokenizer suite 37/37 PASS","complete 42-cell public lifecycle matrix PASS","all 13 committed synthetic fixture negatives realized through production paths","stateful candidate peer and post-return backend rollback traces PASS","combined raw inventory and all governed sidecars reproduced","workflow preflight findings manually classified without suppression"],"date":"2026-08-22","findings":[{"classification":"SCANNER_HEURISTIC_PUBLIC_IDENTITY","severity":"non_blocking","text":"108 duplicate-domain personal_contact findings through the handoff commit are numeric substrings wholly inside required public Git/SHA identities or literal hexadecimal alphabets; no contact data"},{"classification":"GITLEAKS_GENERIC_KEY_PUBLIC_DIGEST","severity":"non_blocking","text":"12 domain findings represent three unique public source/test SHA-256 or cleared-tokenizer commit identities; no credential"}],"gate":"TASK_BUILDER_COMPLETE_PENDING_PERSISTENT_CRITIC_REREVIEW","next_event":"WORKFLOW_COORDINATOR routes the exact package once to authoritative persistent CRITIC","prohibited_actions":["tokenizer or materializer invocation or retry","private custody model or tokenizer access","inference serving qualification or scoring","protected seed or scientific work","STATE or provenance mutation","publication merge or gate decision"],"receiver_role":"WORKFLOW_COORDINATOR","regime":"B","remote_ref":"refs/heads/taskbuilder/m4-post-tokenizer-ir1-ir7-remediation","review_result_sha":"c7bc800b9500af260c59dd81d917058eb58f11dc","role_extension":{"diagnostics_executed":true,"role":"TASK_BUILDER","tests":["40/40 integration","37/37 banked tokenizer","42/42 lifecycle cells","13/13 fixture negatives"]},"routing_ref_sha":"342171993600360c3146030aa893b5a364cb82c2","scan_attestation":{"base_sha":"94ea2c05fcdb74b314f23c229b673bc90ec485f0","findings":["personal_contact fixed-regex findings are required public identity/hexadecimal substrings; no contact data","gitleaks generic-api-key findings are required public source/test/tokenizer identities; no credential"],"manual_review":true,"tip_sha":"342171993600360c3146030aa893b5a364cb82c2","tool_status":"blocked"},"schema_version":"common-handoff-manifest-v1","sender_role":"TASK_BUILDER","status":"READY","transfer_kind":"FORMAL_HANDOFF","work_branch":"taskbuilder/m4-post-tokenizer-ir1-ir7-remediation","work_item":"m4_post_tokenizer_ir1_ir7_implementation_remediation"}
