{"artifacts":{".gitattributes":"52228481c5f216876d9152f927b8f4356038b0d30e1c95bac97f16adaf48aaea","artifacts/m4_tokenizer_materialization/.gitkeep":"e3b0c44298fc1c149afbf4c8996fb92427ae41e4649b934ca495991b7852b855","artifacts/m4_tokenizer_materialization/tokenizer_materialization.json":"19a49a9262be81d30866befda3801b2fc97ef23a8d946d3cc1e4b5de189b3158","artifacts/m4_tokenizer_materialization/tokenizer_materialization.json.sha256":"9ca61b765be8558551a70966eda34cba8f8978d8c6c968d62bce0e5977e026b4","diagnostics/m4_tokenizer_materialization.py":"2aa18bebcfd6c8d7ffb5c65784d5e459650cd540494ae5cfc29e35372c87612b","handoffs/REBECCA_M4_POST_TOKENIZER_INTEGRATION_IMPLEMENTATION_RELEASE_2026-08-22.md":"49e5d9beb7933f5a30045e9236426c3732af0430de990ce0624555252158e752","handoffs/TASK_BUILDER_M4_POST_TOKENIZER_INTEGRATION_QUALITY_TRACE_2026-08-22.md":"b36cc4c76c44e90f7b47b9d2bb65eeb3617c068f9f9dd158cc6c707392c0a36a","handoffs/TASK_BUILDER_TO_WORKFLOW_COORDINATOR_M4_POST_TOKENIZER_INTEGRATION_IMPLEMENTATION_2026-08-22.md":"41f30dce1c69a059d31c3a5932f72ad7b0e66835e3244415f3bfc0206e9d29fd","specs/data/m4_context_format_probe_contract_v1.json":"eab77b9f44a4e9378f5889f5aa368eabd87959a5ddafab9ca38685228f12feec","specs/data/m4_context_format_probe_contract_v1.json.sha256":"26a65895c5a82c99ebf91125dd5ef3b7f0075d28c2c20d746e01fd55e36ca85a","specs/data/m4_post_tokenizer_combined_integration_inventory_v1.json":"acfc96c1ebed0841ded7e7e69e5823decec2174ec23016710321c126718ee450","specs/data/m4_post_tokenizer_combined_integration_inventory_v1.json.sha256":"bfb811dc70393cdbdf69a7595faf7d85ac4a7c90117694c2635321e1e783b791","specs/data/m4_post_tokenizer_integration_oci_launch_contract_v1.json":"3c2fc8709e5b73988d095aef2576e4f98de0e51428a894767819532fb81412b0","specs/data/m4_post_tokenizer_integration_oci_launch_contract_v1.json.sha256":"2ad157a2f4d8986d44b03761817826df82ca5612b36708b9df8ad1d8703d0713","specs/data/m4_tokenizer_executable_package_v1.json":"2c6b13405d79cc105ec1ef8dae913781867108175c36ddb863b6ea7ccd915610","specs/data/m4_tokenizer_executable_package_v1.json.sha256":"a95febab7cd0031ebc74c05678de84cb6ed6329e8bd3810cf7ddf18d57b107fb","specs/data/m4_tokenizer_materialization_blocked_v1.json":"8ba919380b9de1829d6d670c3d9cf2f5b3d49336909cd145a9ce019b073f7150","specs/data/m4_tokenizer_materialization_blocked_v1.json.sha256":"92374160c033451aefbd8e1947a70867295678ee0e30bc758120f923ccb564e3","specs/data/m4_tokenizer_materialization_fail_v1.json":"33faf0aded40dbe2990a7a3e4efca521580f795d70ce049a8ba3daae43860f48","specs/data/m4_tokenizer_materialization_fail_v1.json.sha256":"ed6848f3fa828e5b592ff5fa070a20ae26059792f3d7f9fa0c3a9d333a9cf5e2","specs/data/m4_tokenizer_materialization_request_v1.json":"b39061fd4b19321d58dd418eb5ecd486c0cf26662d70a5d0de4185c6dd7e9992","specs/data/m4_tokenizer_materialization_request_v1.json.sha256":"9fa903fcb29bb74bd0fcd027c2e591668e6aebcb6a77a4c2c179c96c59d8f9ea","specs/data/m4_tokenizer_materialization_result_schema_v1.json":"34179d41e980aca413496f3de9fbbea7b642532b50eeacba423faebe5f4075ca","specs/data/m4_tokenizer_materialization_result_schema_v1.json.sha256":"ca2494f505342959d43b9a6442c103f898e58a54a45279ada3088003536651f3","specs/data/m4_tokenizer_materialization_synthetic_pass_v1.json":"7717eb81e9c1af7c74eeb1b19ebef9d470ebb5772623385fba5623075cff3cde","specs/data/m4_tokenizer_materialization_synthetic_pass_v1.json.sha256":"6baaec6fda24cd312ea53437cef5de27ad9173436ea7b775545335ca7bf225a5","specs/data/m4_tokenizer_materialization_test_contract_v1.json":"edc7f64ba2f1f27d7e5fe62a53e9e3f5e59fea26a527cfe650860298084d936a","specs/data/m4_tokenizer_materialization_test_contract_v1.json.sha256":"fed4e0ce79507cefeb09cc9acdac8da19268966517487f38ea03811d5ee3321d","specs/data/m4_tokenizer_oci_launch_contract_v1.json":"0a5d65e04c55896f603b3a9c611096a242f19b2e293ce356313a22c6e891d9c4","specs/data/m4_tokenizer_oci_launch_contract_v1.json.sha256":"b245473cec2bc3188c12266c1070468be607d869aeb4b3392c66b9c7765339e5","specs/data/m4_tokenizer_private_custody_record_schema_v1.json":"738db87ffd5dd654c69322818df0c63740a7cec8a6e12b08906e63212d7347d6","specs/data/m4_tokenizer_private_custody_record_schema_v1.json.sha256":"f0a530a39ee31cc4fb03f0c4addc5fc333307f39e638e669b3c422e2c2386cd8","specs/data/m4_tokenizer_runtime_unavailable_interpreter_expected_v1.json":"6429a1adf0114a55d34437cbd8d2ad326bc49cef0d23376d6c30519253d6bb04","specs/data/m4_tokenizer_runtime_unavailable_interpreter_expected_v1.json.sha256":"fefb464ca83c5a06f4b233e8eabf2572871fea337783802c104a2d9362dba8f0","specs/data/m4_tokenizer_runtime_unavailable_interpreter_fixture_v1.json":"5583a58b600e9f76dfba3810808e99349a31ebc6a39cb26e87aaccf0c2e8fc3f","specs/data/m4_tokenizer_runtime_unavailable_interpreter_fixture_v1.json.sha256":"bc19c83c6aaac8aee3d32981777d83b73877d1c5f935f09276bd7754a8e273fa","specs/data/m4_tokenizer_runtime_validation_negative_cases_v1.json":"b00a6c73b52f9372b5b7a207ce8eafe24b5ba029e12929e25f9e10163bce521e","specs/data/m4_tokenizer_runtime_validation_negative_cases_v1.json.sha256":"569a6cf000c29828c9813031012243225cefbd2c8e0fd1a9b29214abe0aa7ef1","specs/data/m4_tokenizer_runtime_validation_negative_expected_v1.json":"00cc8d92b5622c7ce21bc45e7cc4a50d3939bdfbc2a8eb0b716a30b018a7ed00","specs/data/m4_tokenizer_runtime_validation_negative_expected_v1.json.sha256":"6b7ea4da9dfcb794bc042e33bc85e174f9e7db215efdefd4d44945a341fe1cb4","specs/m4_local_tokenizer_materialization_changelog.md":"45cf39213d417542ca540889c2db94fbb456e0dae77f5648039edeccb73c4404","specs/m4_local_tokenizer_materialization_spec_v1.md":"ed4ce57fe935d6576655ba6ee1c9296c94af39c2ded0137063ce61d1a4aa53b1","src/__init__.py":"7bfcb8aa72784807a9d941e2f5784593906f0f216624d5cd736c82339027bdca","src/m4_post_tokenizer_integration.py":"932905d33ec37c3f0da8be4cd76824d347dbe16b58825f30bac280a06505552b","src/test_m4_post_tokenizer_integration.py":"934fa8a8de11ab26a8ab43a6f90d8c9babd8a025975df01db96f47f924a354dc","tests/__init__.py":"6f56eb2128751f0c5c1ab27ff461b38565aa00a3dcd29c04ab8bd56c34f4a961","tests/run_m4_post_tokenizer_integration_tests.py":"0d6ba2650d8b7734ca5c44ac6a8022f22961b2a47062e313052d88922f528494","tests/run_m4_tokenizer_materialization_tests.py":"463b1171b656f595dd136b297f73a497b0d8cc646fb537514b1137bc0975b861","tests/test_m4_tokenizer_materialization.py":"3930fdb47986850f4c6c47e5ec1479136c96b74ab51a1c46615591477fb58c1d","tools/testbed/run_m4_tokenizer_topology_smoke_matrix.sh":"860cf3a7522e0c9806c100fdb4d61b47b9c98f7fdb74a0fe62f672c253a2dfde"},"authority_basis":[{"path":"handoffs/REBECCA_M4_POST_TOKENIZER_INTEGRATION_IMPLEMENTATION_RELEASE_2026-08-22.md","sha":"071392aadfcdf6c76b47f3f959578661658f7791"}],"base_sha":"071392aadfcdf6c76b47f3f959578661658f7791","checks_performed":["fresh identity-first wrapper 32/32 PASS","exact pinned network-none read-only OCI integration suite 32/32 PASS","exact pinned network-none read-only OCI banked tokenizer suite 37/37 PASS","complete 42-cell public lifecycle matrix PASS","63-row raw Git-blob inventory reproduced","35 unchanged overlay paths equal cleared tokenizer source","governed sidecars verified in raw Git-blob domain","workflow preflight retained findings; fixed-regex and gitleaks matches manually classified without suppression"],"date":"2026-08-22","findings":[{"classification":"SCANNER_HEURISTIC_PUBLIC_IDENTITY","severity":"non_blocking","text":"personal_contact fixed-regex matches occur wholly inside required public commit/digest identities, the declared public weight byte measurement, or the validator hexadecimal alphabet; no contact data"},{"classification":"GITLEAKS_GENERIC_KEY_PUBLIC_DIGEST","severity":"non_blocking","text":"gitleaks generic-api-key matches are declared public tokenizer/config/artifact SHA-256 or cleared-tokenizer commit identities; no credential"}],"gate":"TASK_BUILDER_COMPLETE_PENDING_PERSISTENT_CRITIC_REVIEW","next_event":"WORKFLOW_COORDINATOR routes exact package once to authoritative persistent CRITIC","prohibited_actions":["tokenizer materializer invocation or retry","private custody/model/tokenizer access","inference or serving","Q2/EF3 qualification or scoring","protected seed or scientific work","STATE/provenance mutation","publication merge or gate decision"],"receiver_role":"WORKFLOW_COORDINATOR","regime":"B","remote_ref":"refs/heads/coordinator/m4-post-tokenizer-integration-implementation-release","review_result_sha":"c0711b5fbf964a56d48f6be3c6bd1b6008548832","role_extension":{"diagnostics_executed":true,"role":"TASK_BUILDER","tests":["32/32 integration","37/37 banked tokenizer","42/42 lifecycle cells"]},"routing_ref_sha":"071392aadfcdf6c76b47f3f959578661658f7791","scan_attestation":{"base_sha":"071392aadfcdf6c76b47f3f959578661658f7791","findings":["personal_contact fixed-regex matches occur wholly inside required public commit/digest identities, the declared public weight byte measurement, or the validator hexadecimal alphabet; no contact data","gitleaks generic-api-key matches are declared public tokenizer/config/artifact SHA-256 or cleared-tokenizer commit identities; no credential"],"manual_review":true,"tip_sha":"6b82328f0d61e4dd3bf330b0cd5d4b825fbf6af6","tool_status":"blocked"},"schema_version":"common-handoff-manifest-v1","sender_role":"TASK_BUILDER","status":"READY","transfer_kind":"FORMAL_HANDOFF","work_branch":"taskbuilder/m4-post-tokenizer-integration-implementation","work_item":"m4_post_tokenizer_integration_implementation"}
