{"artifacts":{".gitattributes":"03a4a697fd0aefe179874343764ac8fba05ea1f7df2076a1b0ff9b31acb6d994","handoffs/REBECCA_M4_POST_TOKENIZER_INTEGRATION_IMPLEMENTATION_RELEASE_2026-08-22.md":"49e5d9beb7933f5a30045e9236426c3732af0430de990ce0624555252158e752","handoffs/TASK_BUILDER_M4_POST_TOKENIZER_RRIR1_RRIR4_QUALITY_TRACE_2026-08-22.md":"82982d9e64a3cbb485fe4f1961ed535c7c74bca37be0fafa6d780a9de4983aff","handoffs/TASK_BUILDER_TO_WORKFLOW_COORDINATOR_M4_POST_TOKENIZER_RRIR1_RRIR4_REMEDIATION_2026-08-22.md":"df092f0bdc27aa73f386d11dd4feeb289a7f46b40038316e669df9c73d1c2194","specs/data/m4_post_tokenizer_combined_integration_inventory_v1.json":"9f53d4c214f11d8f04aad54ea17c8acb487b3c6fb24d70b464de57b2ac624bf5","specs/data/m4_post_tokenizer_combined_integration_inventory_v1.json.sha256":"e4adf607775006521ffec22c794fcc01b8451728fd38d4b9e7206d23e7ff95e1","specs/data/m4_post_tokenizer_integration_oci_launch_contract_v1.json":"edd2116c95aa48926dec4714c7f1c27712cc08b9750d67a861d4cc1472cd9772","specs/data/m4_post_tokenizer_integration_oci_launch_contract_v1.json.sha256":"028d48d20fa0d76b03917b1c043b5ae9ecd27157af08a872345d0f730f449118","specs/data/m4_tokenizer_executable_package_v1.json":"ee5f7bc601d94153d5819453d2f22a8fc6110103c88bd8242ac3ebe5c78ea2bc","specs/data/m4_tokenizer_executable_package_v1.json.sha256":"8237c04033cb77f90ce62fecd2f7adf8866426cdfd95360623f8088b3989903c","src/m4_post_tokenizer_integration.py":"9db0155a5de800774ff8476bf02993e340dfd785336890860587ab22daf2dfb7","src/test_m4_post_tokenizer_integration.py":"4aa5690e9ccc8935b1d0753f11932754b69af539d9049a801d94a040770057d4","tests/run_m4_post_tokenizer_integration_tests.py":"bc955c2b8502387858092afd20313d2f09ac065749dc0fea2f709f36167fbede","tests/run_m4_tokenizer_materialization_tests.py":"6710271634586cde643d06bba26f7ebcbdda6e51770ce1b2177e4abe45ff267c"},"authority_basis":[{"path":"handoffs/REBECCA_M4_POST_TOKENIZER_INTEGRATION_IMPLEMENTATION_RELEASE_2026-08-22.md","sha":"071392aadfcdf6c76b47f3f959578661658f7791"}],"base_sha":"656a0fa611619a9d19158efae4675ef165769434","checks_performed":["fresh core.autocrlf=true identity-first wrapper 49/49 PASS","exact pinned WSL2-backed network-none read-only OCI integration suite 49/49 PASS","exact pinned WSL2-backed network-none read-only OCI banked tokenizer suite 37/37 PASS","complete 42-cell public lifecycle matrix PASS","all 13 committed synthetic fixture negatives realized through production paths","eleven executable production mutations killed 11/11","fanout law history live-attestation rollback fixture frozen-provider pair and state traces PASS","combined 63-entry raw inventory and 25 contained sidecars reproduced","workflow preflight findings manually classified without suppression"],"date":"2026-08-22","findings":[{"classification":"SCANNER_HEURISTIC_PUBLIC_IDENTITY","severity":"non_blocking","text":"94 duplicate-domain personal_contact findings through the routing commit are numeric substrings wholly inside required public Git/SHA identities or literal hexadecimal alphabets; no contact data"},{"classification":"GITLEAKS_GENERIC_KEY_PUBLIC_DIGEST","severity":"non_blocking","text":"12 domain findings are duplicated required public source/test/digest identity matches; no credential"}],"gate":"TASK_BUILDER_COMPLETE_PENDING_PERSISTENT_CRITIC_REREVIEW","next_event":"WORKFLOW_COORDINATOR routes the exact package once to authoritative persistent CRITIC","prohibited_actions":["tokenizer or materializer invocation or retry","private custody model or tokenizer access","inference serving qualification or scoring","protected seed or scientific work","STATE or provenance mutation","publication merge or gate decision"],"receiver_role":"WORKFLOW_COORDINATOR","regime":"B","remote_ref":"refs/heads/taskbuilder/m4-post-tokenizer-rrir1-rrir4-remediation","review_result_sha":"f44ad96b133096d0096a5c43574f47d69f489756","role_extension":{"diagnostics_executed":true,"role":"TASK_BUILDER","tests":["49/49 integration","37/37 banked tokenizer","42/42 lifecycle cells","13/13 fixture negatives","11/11 executable production mutations killed"]},"routing_ref_sha":"6501f24f041af0bf4d4d3923d2a5b6b2696772e1","scan_attestation":{"base_sha":"656a0fa611619a9d19158efae4675ef165769434","findings":["personal_contact fixed-regex findings are required public identity/hexadecimal substrings; no contact data","gitleaks generic-api-key findings are required public source/test/tokenizer identities; no credential"],"manual_review":true,"tip_sha":"6501f24f041af0bf4d4d3923d2a5b6b2696772e1","tool_status":"blocked"},"schema_version":"common-handoff-manifest-v1","sender_role":"TASK_BUILDER","status":"READY","transfer_kind":"FORMAL_HANDOFF","work_branch":"taskbuilder/m4-post-tokenizer-rrir1-rrir4-remediation","work_item":"m4_post_tokenizer_rrir1_rrir4_implementation_remediation"}
