{
  "schema_version": "common-handoff-manifest-v1",
  "date": "2026-08-21",
  "regime": "B",
  "transfer_kind": "FORMAL_HANDOFF",
  "work_item": "m4_tokenizer_cr_ffrbf1_imported_class_remediation",
  "gate": "CR-FFRBF1 imported class identity remediation before persistent-CRITIC rereview",
  "sender_role": "TASK_BUILDER",
  "receiver_role": "WORKFLOW_COORDINATOR",
  "authority_basis": [{"path": "reviews/critic_m4_tokenizer_cr_frbf1_final_rereview.md", "sha": "35bcb4209cd9b4159877856dd0b3f565fbad7573"}],
  "remote_ref": "refs/heads/taskbuilder/m4-tokenizer-cr-ffrbf1-imported-class-remediation",
  "base_sha": "543340f7d9f31271d80280c67813bfd84c90398c",
  "routing_ref_sha": "ced4ff9da3c50a386a41d37705323226eddd103c",
  "review_result_sha": "35bcb4209cd9b4159877856dd0b3f565fbad7573",
  "work_branch": "taskbuilder/m4-tokenizer-cr-ffrbf1-imported-class-remediation",
  "artifacts": {
    ".gitattributes": "68c528ede67720007d4ec15d15f6d723136a24b9a4662c94ad9cdfbbc158601d",
    "diagnostics/m4_tokenizer_materialization.py": "90e89b5a55ff80041a8e09c0d3e96208b6d8eff5c6b39eecd6366a1afb5289af",
    "handoffs/TASK_BUILDER_TO_COORDINATOR_M4_TOKENIZER_CR_FFRBF1_IMPORTED_CLASS_REMEDIATION_2026-08-21.md": "da2b858f016ad64273061501243506daf8b56452e6f7d38df4c4de5bcecad2d1",
    "reviews/critic_m4_tokenizer_cr_frbf1_final_rereview.md": "b744328cd506100d6d355ebf2a4ed99b1ffbd00499b1f6bca161b4a1046b9de1",
    "specs/data/m4_context_format_probe_contract_v1.json": "eab77b9f44a4e9378f5889f5aa368eabd87959a5ddafab9ca38685228f12feec",
    "specs/data/m4_context_format_probe_contract_v1.json.sha256": "26a65895c5a82c99ebf91125dd5ef3b7f0075d28c2c20d746e01fd55e36ca85a",
    "specs/data/m4_tokenizer_executable_package_v1.json": "57f448829b7a08fbb23bdb60ea29cee961352d4690806fe33abb335b0807bdc1",
    "specs/data/m4_tokenizer_executable_package_v1.json.sha256": "975d58f3cde0c789c5a40adfe3a9d077f5f4fa9f5728a0ac253a3cd6dac20887",
    "specs/data/m4_tokenizer_materialization_request_v1.json": "b39061fd4b19321d58dd418eb5ecd486c0cf26662d70a5d0de4185c6dd7e9992",
    "specs/data/m4_tokenizer_materialization_request_v1.json.sha256": "9fa903fcb29bb74bd0fcd027c2e591668e6aebcb6a77a4c2c179c96c59d8f9ea",
    "specs/data/m4_tokenizer_materialization_result_schema_v1.json": "34179d41e980aca413496f3de9fbbea7b642532b50eeacba423faebe5f4075ca",
    "specs/data/m4_tokenizer_materialization_result_schema_v1.json.sha256": "ca2494f505342959d43b9a6442c103f898e58a54a45279ada3088003536651f3",
    "specs/data/m4_tokenizer_materialization_test_contract_v1.json": "c166a583a0612054cea826700d8e5e2c132c283e1617727170a8bd57167bb7a0",
    "specs/data/m4_tokenizer_materialization_test_contract_v1.json.sha256": "189405411c37f4333f2edd1339711bb316c0a26f3e7e54f01362ca7662277fd7",
    "specs/data/m4_tokenizer_oci_launch_contract_v1.json": "0fdd5e8eed2fc3a7cc5e10512e6e01037d011f6cf51e862a2293d49255b32848",
    "specs/data/m4_tokenizer_oci_launch_contract_v1.json.sha256": "2f274dbbacf64085bd3298aaaad6702ce2bfff700bd85d5c3773a29cb410448d",
    "specs/data/m4_tokenizer_private_custody_record_schema_v1.json": "738db87ffd5dd654c69322818df0c63740a7cec8a6e12b08906e63212d7347d6",
    "specs/data/m4_tokenizer_private_custody_record_schema_v1.json.sha256": "f0a530a39ee31cc4fb03f0c4addc5fc333307f39e638e669b3c422e2c2386cd8",
    "specs/m4_local_tokenizer_materialization_spec_v1.md": "2f60b9ecb90628028465f17d31702fe17ce037ef60fd05ef15ae4e25512ad682",
    "tests/__init__.py": "6f56eb2128751f0c5c1ab27ff461b38565aa00a3dcd29c04ab8bd56c34f4a961",
    "tests/run_m4_tokenizer_materialization_tests.py": "29dc1c0d83e71c850e9eb3c423cfd359a6c557956d1eab1fa5d9beb049271d1d",
    "tests/test_m4_tokenizer_materialization.py": "964ab5b8cb5ef63627c0ab07b3f0c4c867684d7add40576c3dd61494610e8613"
  },
  "checks_performed": [
    "read the authoritative CRITIC BLOCK and created an exact isolated helper checkout",
    "mapped every CR-FFRBF1 production branch to separate adversarial materialize subcases and exact evidence in the return artifact",
    "proved root-module origin, class identity, class metadata, class origin, and loading-method origin before custody",
    "proved the successful pinned import-origin trace precedes custody lookup and never invokes from_pretrained",
    "instrumented every prohibited custody/private/tokenizer/model/copy/loading event to raise immediately",
    "confirmed all banked production rows remain covered and passing",
    "created a fresh exact-result checkout and ran the pinned suite with 35 of 35 tests passing",
    "ran preflight hotfix cee97538893989e055f49a894f066d2083da4eb5 and manually classified all 35 final findings without suppression"
  ],
  "status": "READY",
  "findings": [{"classification": "CR-FFRBF1 integrated remediation", "severity": "non_blocking", "text": "five imported module/class/loading identity adversaries reject before custody; the successful pinned identity trace also precedes custody"}],
  "scan_attestation": {
    "base_sha": "35bcb4209cd9b4159877856dd0b3f565fbad7573",
    "tip_sha": "ced4ff9da3c50a386a41d37705323226eddd103c",
    "tool_status": "blocked",
    "manual_review": true,
    "findings": [
      "33 duplicate-domain personal-contact findings occur wholly inside required immutable public commit values or declared public artifact digests and are non-secret reproducibility metadata",
      "two duplicate-domain gitleaks generic-key findings occur on the declared public AutoTokenizer loader-file SHA-256 and are non-secret runtime identity metadata",
      "manual review found no credential, personal contact data, private path, task identifier, custody value, model/tokenizer byte, protected seed, scientific output, or prohibited durable-state mutation"
    ]
  },
  "next_event": "WORKFLOW COORDINATOR acknowledges this return and routes the exact package to authoritative persistent CRITIC for one rereview",
  "prohibited_actions": ["custody lookup, OCI materialization, retry, fallback, model/tokenizer access, inference, serving, or qualification", "diagnostics, scoring, protected seeds, science, STATE/provenance mutation, merge, publication, or gate decision"],
  "role_extension": {"role": "TASK_BUILDER", "tests": ["python3 -I tests/run_m4_tokenizer_materialization_tests.py — 35/35 PASS in exact pinned no-custody container"], "diagnostics_executed": false}
}
