{"artifacts":{"docs/rulings/judge_m4_post_tokenizer_implementation_readiness_ruling.md":"ca77333e20c8a2f6accbd32d2f79b9ca3b256f8050faa7981f7f14bf10e0c5b0","docs/rulings/provenance_log.md":"a4123e9cb315c20c0bc2b237ba1f607057d36ade101a1484ae66a6c34eee25e8","docs/rulings/provenance_log.metadata.json":"f6f3af7741027fa38088b5231d0ea7ece4ad60ea8554574dcdd5849a645f4c94","docs/rulings/provenance_log.metadata.json.sha256":"9d82da70ad501de264a8f4aef92fff7d4d6d7e68fde04cee6219de1f6f18acb7","handoffs/REBECCA_M4_POST_TOKENIZER_IMPLEMENTATION_READINESS_JUDGE_AUTHORITY_2026-08-22.md":"0cb7d51fa8cbe2e088d2be4b0c21275845b89c36fd35a7bbec2b5369d504dfc9","reviews/critic_m4_post_tokenizer_rrr2_f1_final_recovery_rereview.md":"40477132ec3eb5f452ff7e9031516712b89dbef9bea8248b38132c484b96c89a"},"authority_basis":[{"path":"handoffs/REBECCA_M4_POST_TOKENIZER_IMPLEMENTATION_READINESS_JUDGE_AUTHORITY_2026-08-22.md","sha":"2bb9e04adc73ea324c8be58f66db16c62f2aa1ba"},{"path":"reviews/critic_m4_post_tokenizer_rrr2_f1_final_recovery_rereview.md","sha":"bc1bd5a1c86f0e2cd9f316e6e0fb339278fb60f2"}],"base_sha":"909d2a4a6b4ceafb871e11c1757d873cfa1a4c41","checks_performed":["canonical JUDGE envelope schema and exact filename validated","standard padded RFC 4648 base64 decoded and re-encoded identically","ruling UTF-8 BOM CR and single-final-LF rules validated","ruling byte length raw SHA-256 Git blob and filename uniqueness independently verified","Coordinator route remote identity ancestry and named authority blobs verified","provenance Entry 117 appended without rewriting prior entries","provenance metadata and sidecar validated against canonical repository bytes","complete introduced range scanned and every deterministic finding manually classified","gitleaks 8.30.1 returned zero findings"],"date":"2026-08-22","findings":[{"classification":"SCANNER_HEURISTIC_IMMUTABLE_PUBLIC_IDENTITY","severity":"non_blocking","text":"Two ruling-file and the newly introduced Entry 117 contact-pattern matches occur wholly inside required immutable public commit or digest values; no contact data is introduced."},{"classification":"SCANNER_COMPLETE_FILE_HISTORICAL_CONTENT","severity":"non_blocking","text":"Complete-file scanning retained 27 contact-pattern and eight private-path matches in the append-only provenance result; manual diff review confirms non-identity matches are unchanged historical content and the new entry contains no private path or contact data."},{"classification":"SCANNER_COMMIT_METADATA","severity":"non_blocking","text":"Two pathless contact-pattern matches are the established repository-local MOR RECORDER commit identity, not personal contact data."}],"gate":"NON_SCORING_IMPLEMENTATION_READINESS_RULING_CUSTODY","next_event":"WORKFLOW COORDINATOR verifies remote equality and presents the durable BLOCK — INSTRUMENT FAILURE ruling to Rebecca for disposition and authorized remediation routing","prohibited_actions":["treat custody publication as gate approval or operative ruling","tokenizer or materializer invocation rerun or new operation","private custody model tokenizer path or protected-seed access","inference serving qualification scoring Q2 EF3 native-L8 or other science","implementation change package substitution STATE edit or evidence relabeling","repository merge model publication result publication or final project gate decision"],"receiver_role":"WORKFLOW_COORDINATOR","regime":"B","remote_ref":"refs/heads/coordinator/m4-post-tokenizer-implementation-judge-route","review_result_sha":"bc1bd5a1c86f0e2cd9f316e6e0fb339278fb60f2","role_extension":{"custody_hashes":["ca77333e20c8a2f6accbd32d2f79b9ca3b256f8050faa7981f7f14bf10e0c5b0","a4123e9cb315c20c0bc2b237ba1f607057d36ade101a1484ae66a6c34eee25e8","f6f3af7741027fa38088b5231d0ea7ece4ad60ea8554574dcdd5849a645f4c94","9d82da70ad501de264a8f4aef92fff7d4d6d7e68fde04cee6219de1f6f18acb7"],"role":"RECORDER"},"routing_ref_sha":"2bb9e04adc73ea324c8be58f66db16c62f2aa1ba","scan_attestation":{"base_sha":"2bb9e04adc73ea324c8be58f66db16c62f2aa1ba","findings":["F000001-F000002 immutable public identities in the exact ruling bytes; non-contact reproducibility metadata","F000003-F000037 complete-file historical provenance matches or immutable identities; no new private path or contact data","F000038-F000039 established repository-local RECORDER commit identity; no personal contact data","gitleaks 8.30.1 returned zero findings"],"manual_review":true,"tip_sha":"d707420d0c968442933f1b5bab5abea398316ade","tool_status":"blocked"},"schema_version":"common-handoff-manifest-v1","sender_role":"RECORDER","status":"PENDING_REBECCA","transfer_kind":"FORMAL_HANDOFF","work_branch":"recorder/m4-post-tokenizer-implementation-readiness-ruling","work_item":"m4_post_tokenizer_implementation_readiness_ruling_custody"}
