{"artifacts":{".gitattributes":"9de833efed2647fbe5ad2cb6c16ef235d721c3b2a5f643335459d74c697274a6","handoffs/ARCHITECT_TO_COORDINATOR_M4_POST_TOKENIZER_INTEGRATION_CRASH_CART_DESIGN_2026-08-21.md":"911ea0438ba7440e734f51bc392db33097ea8a527ac4f21fa0674ec233cdcfaf","specs/data/m4_post_tokenizer_integration_contract_v1.json":"6e7178bfd3fe2b0381928008fc0a70f3ba4e8fa3a8c5b6d87b715b700da4ce76","specs/data/m4_post_tokenizer_integration_contract_v1.json.sha256":"32a2a57e43304e6a4dbe534b3b93b5ac379153f97b239dbb8c1440e61acc0c38","specs/data/m4_post_tokenizer_synthetic_integration_fixture_v1.json":"7eb67fbfdc2d6953045585b5d680dc4954ddcf05fe1046ecb50eafbb09e4804c","specs/data/m4_post_tokenizer_synthetic_integration_fixture_v1.json.sha256":"4b08103c267114028d276b727f9fee31340612d4698d39b5cd551e273e395c12","specs/m4_post_tokenizer_integration_crash_cart_spec_v1.md":"f218f0ef6dbe41120eee49ab8111c632d7af1750fbb3836ad4b7c64c560f9caf"},"authority_basis":[{"path":"specs/m4_post_tokenizer_integration_crash_cart_spec_v1.md","sha":"d225cfd2f9fb8d61e8039cbf4cf4d1d6c1949079"}],"base_sha":"cee97538893989e055f49a894f066d2083da4eb5","checks_performed":["independent same-checkpoint authority trace to later Principal decision at 45d40d8b688fb7f44098d235df7f31cca1aa3b31","independent scaffold backend lifecycle and semantic-validation gap audit","independent tokenizer/scaffold lineage and deterministic union audit","JSON parse and adjacent sidecar reproduction","complete raw Git-blob byte SHA-256 mode inventory","diff self-inspection confirms design-only paths","workflow preflight across each commit and combined range with all findings manually classified"],"date":"2026-08-21","findings":[{"classification":"manual_public_identity_classification","severity":"non_blocking","text":"Eighteen fixed-regex personal-contact findings occur wholly inside required immutable commit or artifact digest strings, including duplicated scan domains."},{"classification":"manual_public_digest_classification","severity":"non_blocking","text":"Eight gitleaks generic-key findings are duplicated scan-domain matches on the explicitly named audit_tokenizer_sha field bound to a public immutable commit identity; no credential is present."}],"gate":"M4_POST_TOKENIZER_INTEGRATION_CRASH_CART_DESIGN","next_event":"WORKFLOW_COORDINATOR routes this exact complete design package once to persistent CRITIC","prohibited_actions":["implementation or backend selection","custody model or tokenizer access","scoring seeds or science","STATE or provenance mutation","merge publication or gate decision"],"receiver_role":"WORKFLOW_COORDINATOR","regime":"B","remote_ref":"refs/heads/architect/m4-post-tokenizer-integration-crash-cart-design","review_result_sha":"d225cfd2f9fb8d61e8039cbf4cf4d1d6c1949079","role_extension":{"changelog_paths":["specs/m4_post_tokenizer_integration_crash_cart_spec_v1.md"],"diff_self_inspection":true,"role":"ARCHITECT"},"routing_ref_sha":"034751878933d9d498ae8d8306343fa85ce8e1bd","scan_attestation":{"base_sha":"cee97538893989e055f49a894f066d2083da4eb5","findings":["F000001-F000026 manually classified as required public immutable commit/artifact identities or scanner generic-key interpretation of the explicitly named public audit_tokenizer_sha binding"],"manual_review":true,"tip_sha":"034751878933d9d498ae8d8306343fa85ce8e1bd","tool_status":"blocked"},"schema_version":"common-handoff-manifest-v1","sender_role":"ARCHITECT","status":"READY","transfer_kind":"FORMAL_HANDOFF","work_branch":"architect/m4-post-tokenizer-integration-crash-cart-design","work_item":"m4_post_tokenizer_integration_crash_cart_design"}
