{
  "schema_version": "common-handoff-manifest-v1",
  "date": "2026-08-21",
  "regime": "B",
  "transfer_kind": "FORMAL_HANDOFF",
  "work_item": "m4_tokenizer_corrective_release_topology_gate_block",
  "gate": "Mandatory custody-free topology matrix before the corrected new tokenizer-materialization operation",
  "sender_role": "TASK_BUILDER",
  "receiver_role": "WORKFLOW_COORDINATOR",
  "authority_basis": [
    {
      "path": "handoffs/REBECCA_M4_TOKENIZER_PRIVATE_BINDING_CORRECTIVE_RELEASE_2026-08-21.md",
      "sha": "1e2e910adff95ce47bcbef1c28eff8213b71acae"
    }
  ],
  "remote_ref": "refs/heads/taskbuilder/m4-tokenizer-private-binding-corrective-execution",
  "base_sha": "1e2e910adff95ce47bcbef1c28eff8213b71acae",
  "routing_ref_sha": "e391c0d681c780993f2516590c55075ba1bd7827",
  "review_result_sha": "482bdeceea8461438c516dcb8944bbaa21e5192c",
  "work_branch": "taskbuilder/m4-tokenizer-private-binding-corrective-execution",
  "artifacts": {
    ".gitattributes": "998b713a5094f924efa62fc0c65f1195f385ea08476ee1d150ea2527d6e04c4c",
    "artifacts/m4_tokenizer_materialization/.gitkeep": "e3b0c44298fc1c149afbf4c8996fb92427ae41e4649b934ca495991b7852b855",
    "artifacts/m4_tokenizer_materialization/tokenizer_materialization.json": "10a14c1a4f7b257aa195636ab86b7a85a68fc084af13bead7b5d4b3ecfa55728",
    "artifacts/m4_tokenizer_materialization/tokenizer_materialization.json.sha256": "da7a294daf21aa308cb0b7ac83dafba85323c2e0667a33a0844829a18b86756a",
    "diagnostics/m4_tokenizer_materialization.py": "2aa18bebcfd6c8d7ffb5c65784d5e459650cd540494ae5cfc29e35372c87612b",
    "handoffs/REBECCA_M4_TOKENIZER_FULL_DOMAIN_NEW_OPERATION_RELEASE_2026-08-21.md": "29bca723ffaa9267ebd83258605fbeb15f9c37b3c06dae1768d4b2d2759acf7e",
    "handoffs/REBECCA_M4_TOKENIZER_PRIVATE_BINDING_CORRECTIVE_RELEASE_2026-08-21.md": "047ca514bfc581c68bb69b96bd0b88f08a641f259667e0719ab664501931306b",
    "handoffs/TASK_BUILDER_TO_COORDINATOR_M4_FULL_TOKEN_ID_DOMAIN_REMEDIATION_2026-08-21.md": "1c0dc526c816c3eb9c6cdedb14f62ffb229e25866e5901d51835f50a05e024b9",
    "handoffs/TASK_BUILDER_TO_COORDINATOR_M4_TOKENIZER_CORRECTIVE_RELEASE_TOPOLOGY_GATE_BLOCK_2026-08-21.md": "a7db1196e00ad0b50c452bf698ec6d3edc6c38bc56f58e9b40b9efca4f7a0ec4",
    "handoffs/TASK_BUILDER_TO_COORDINATOR_M4_TOKENIZER_FULL_DOMAIN_NEW_OPERATION_PRIVATE_BINDING_BLOCK_2026-08-21.md": "d3ec29ab57a98fac46b73d5ae7dd546010126e7ed0118c55848baffce79a4ee6",
    "handoffs/TASK_BUILDER_TO_COORDINATOR_M4_TOKENIZER_FULL_DOMAIN_NEW_OPERATION_PRIVATE_BINDING_BLOCK.manifest.json": "76a2641cf80be4320c7ed96cca707be8877fed316fd9e1141296952bc478eac9",
    "handoffs/TASK_BUILDER_TO_COORDINATOR_M4_TOKENIZER_MATERIALIZATION_FAIL_2026-08-21.md": "fc16d16e2471a0305bca9d65a0af36be0d1e2ff22dcb7919efa57706f88438f4",
    "specs/data/m4_context_format_probe_contract_v1.json": "eab77b9f44a4e9378f5889f5aa368eabd87959a5ddafab9ca38685228f12feec",
    "specs/data/m4_tokenizer_executable_package_v1.json": "f8e97a6ce4f0da4bb47a4b720e82cd3c909da128a41146374c9faa490c4429fa",
    "specs/data/m4_tokenizer_executable_package_v1.json.sha256": "cd43a495b383ebd3201d6828c685838c3b0787a9d7333449035de93a066d6e66",
    "specs/data/m4_tokenizer_materialization_request_v1.json": "b39061fd4b19321d58dd418eb5ecd486c0cf26662d70a5d0de4185c6dd7e9992",
    "specs/data/m4_tokenizer_materialization_request_v1.json.sha256": "9fa903fcb29bb74bd0fcd027c2e591668e6aebcb6a77a4c2c179c96c59d8f9ea",
    "specs/data/m4_tokenizer_materialization_result_schema_v1.json": "34179d41e980aca413496f3de9fbbea7b642532b50eeacba423faebe5f4075ca",
    "specs/data/m4_tokenizer_materialization_result_schema_v1.json.sha256": "ca2494f505342959d43b9a6442c103f898e58a54a45279ada3088003536651f3",
    "specs/data/m4_tokenizer_materialization_test_contract_v1.json": "561bae3e04ce81422b73601b0ae9e6835522919dc10e340fcc39e4b03791a1c2",
    "specs/data/m4_tokenizer_materialization_test_contract_v1.json.sha256": "d703e696525787ac0b87ca565d59ac89331ababd60c856c4addda037686299a6",
    "specs/data/m4_tokenizer_oci_launch_contract_v1.json": "ca465aa11dbafff74a62126c3e263dda547796cd9003983c93a015ae74bca0e9",
    "specs/data/m4_tokenizer_oci_launch_contract_v1.json.sha256": "6ec63d1baf5ae66e0e0659ff88b06cd1bcffe3d59711c534df2a2bb8a5a95eba",
    "tests/__init__.py": "6f56eb2128751f0c5c1ab27ff461b38565aa00a3dcd29c04ab8bd56c34f4a961",
    "tests/run_m4_tokenizer_materialization_tests.py": "4f4aa5a873f59c3dbc368c550a84f61564c181f5570fdbcb2e54b6b8f8f8d734",
    "tests/test_m4_tokenizer_materialization.py": "5c2c123f9c64ca034b7f4c40307026cc476a1dc5bdf02e7dc6fc85c5b82a8eab",
    "tools/testbed/run_m4_tokenizer_topology_smoke_matrix.sh": "a0f4383913a38cdde9f93947865d990e36b41fb538ff1468b121f4b1db2b137a"
  },
  "checks_performed": [
    "created a fresh helper-managed checkout at the exact corrective release and verified clean immutable release identity",
    "reproduced all nine executable-package artifacts and five governed adjacent sidecars from raw committed Git blob bytes",
    "verified WSL2-backed Docker 29.1.3, linux/amd64, and the exact locally present pinned platform image with pull disabled",
    "ran the exact pinned network-disabled read-only no-custody wrapper: 37 tests passed, exit 0",
    "ran the committed custody-free topology matrix and stopped on its nonzero absent-marker fixture construction failure after the positive case passed with an empty stage",
    "verified that the immutable release's preserved historical result pair makes the copied output directory nonempty after the runner removes only its marker",
    "tested the narrow fixture-only proposal in a disposable exact-release checkout: bash syntax passed and all four custody-free topology cases plus cleanup passed; removed the disposable checkout",
    "verified no private binding use, custody access, output stage for materialization, or materializer process start and the corrected new operation remains UNCONSUMED",
    "reproduced the complete 27-entry public artifact inventory from raw committed Git blob bytes",
    "ran workflow_preflight.py hotfix cee97538893989e055f49a894f066d2083da4eb5 against the exact worktree and complete release-to-return range and manually classified every finding without suppression"
  ],
  "status": "BLOCKED",
  "findings": [
    {
      "classification": "TOPOLOGY_ABSENT_MARKER_FIXTURE_STALE_OUTPUT_CONFLICT",
      "severity": "blocking",
      "text": "the committed absent-marker fixture removes only .gitkeep, but the required preserved historical result pair keeps the copied output directory nonempty and causes rmdir to fail before the negative Docker invocation"
    }
  ],
  "scan_attestation": {
    "base_sha": "1e2e910adff95ce47bcbef1c28eff8213b71acae",
    "tip_sha": "e391c0d681c780993f2516590c55075ba1bd7827",
    "tool_status": "clean",
    "manual_review": true,
    "findings": [
      "fixed-regex scanners returned zero findings and gitleaks 8.30.1 returned zero findings",
      "manual review found no credentials, personal contact data, private paths or binding values, custody data, model/tokenizer bytes, complete token arrays, protected seeds, scientific output, or prohibited durable-state mutation"
    ]
  },
  "next_event": "WORKFLOW COORDINATOR routes the exact fixture defect and tested minimal proposal through ARCHITECT and persistent-CRITIC correction before any subsequent exact execution release; the corrected new operation remains unconsumed",
  "prohibited_actions": [
    "materializer start, retry, fallback, alternate root, image, interpreter, runtime, topology, command, normalization, copying, synthesis, or invention",
    "private binding publication, custody/model/tokenizer access, inference, qualification, scoring, seeds, science, STATE/provenance mutation, model/tokenizer publication, merge, further operation, or gate decision"
  ],
  "role_extension": {
    "role": "TASK_BUILDER",
    "tests": [
      "raw executable-package and governed sidecar identities: PASS",
      "exact pinned no-custody wrapper: 37/37 PASS, exit 0",
      "committed topology runner: positive PASS then absent-marker fixture construction BLOCK",
      "disposable one-line fixture proposal: bash syntax and all four topology cases PASS with cleanup complete"
    ],
    "diagnostics_executed": false
  }
}
